{
  "id": "thealgorithms-python",
  "name": "The Algorithms - Python",
  "source_url": "https://github.com/TheAlgorithms/Python",
  "target_path": "algorithms/thealgorithms-python",
  "owner": "TheAlgorithms",
  "license": "MIT",
  "domain": "algorithms",
  "tier": "T1-architecture",
  "priority": 1,
  "languages": ["python"],
  "concepts": ["algorithms", "data-structures", "sorting", "searching", "graphs", "dynamic-programming", "backtracking", "divide-conquer", "greedy", "recursion"],
  "patterns": ["algorithm-implementation", "educational-code", "reference-implementation"],
  "tags": ["algorithms", "data-structures", "computer-science", "interview-prep", "educational"],
  "description": "All Algorithms implemented in Python - comprehensive collection of algorithm implementations for education and reference.",
  "why_include": "Gold standard for algorithm implementations in Python. Essential for code generation and algorithm explanation.",
  "estimated_size_mb": 50,
  "mirrored": true,
  "indexed": false
}
